{
  "generated_at": "2026-09-05T05:10:00+00:00",
  "generated_local": "Fri 05 Sep 2026, 07:10",
  "timezone": "Europe/Rome",
  "schedule": {
    "timezone": "Europe/Rome",
    "hours": [7, 13, 19],
    "minute": 0,
    "grace_minutes": 45
  },
  "mode": "llm",
  "model": "claude-sonnet-4-6",
  "feed_health": [],
  "usage": { "calls": 3, "input_tokens": 12000, "output_tokens": 2000, "est_cost_usd": 0.06, "est_month_usd": 5.4 },
  "sections": {
    "news": {
      "briefing": [{ "text": "Legacy bullet without source_ids wrapper.", "sources": [] }],
      "items": [{ "key": "legacy1", "title": "Old story", "url": "https://example.com/old", "source": "BBC", "new": false }],
      "candidate_count": 20,
      "new_count": 0,
      "reviewed_count": 20
    },
    "sport": { "briefing": [], "items": [], "candidate_count": 15, "new_count": 0, "reviewed_count": 15 },
    "finance": { "briefing": [], "items": [], "tickers": [], "candidate_count": 10, "new_count": 0, "reviewed_count": 10 },
    "media": { "briefing": "", "items": [], "candidate_count": 5, "new_count": 0, "reviewed_count": 0 }
  }
}
